{
 "schema_version": 1,
 "generated_at": "2026-10-15T09:35:06.408Z",
 "qa_skill_name": "profolio-ksa-design",
 "qa_skill_version": "2.5.1",
 "ids_available": false,
 "render_available": true,
 "scope": {
  "feature": "leads-marketplace",
  "pages": [
   "marketplace"
  ],
  "platforms": [
   "web",
   "phone"
  ],
  "locales": [
   "en"
  ],
  "profile": "hifi"
 },
 "verdict": "pass_with_warnings",
 "counts": {
  "blocker": 0,
  "warning": 98,
  "note": 7,
  "waived": 0,
  "skipped_checks": 0
 },
 "findings": [
  {
   "check": "pf.contrast",
   "severity": "warning",
   "screen": "leads-marketplace",
   "case": "web · owner, seeker, first-visit, bought, gone, loading, empty, error, owner › Expand side menu, owner › Select City, owner › Select Price, owner › Newest FirstHighest PriceLowest Price, seeker › Select Property Types, owner · missing data, owner · long data, owner · arabic data, owner · zero data, seeker · missing data, seeker · long data, seeker · arabic data, seeker · zero data, owner · new copy long, owner · new copy in Arabic, seeker · new copy long, seeker · new copy in Arabic, first-visit · new copy long, first-visit · new copy in Arabic, bought · new copy long, bought · new copy in Arabic, gone · new copy long, gone · new copy in Arabic, loading · new copy long, loading · new copy in Arabic, empty · new copy long, empty · new copy in Arabic, error · new copy long, error · new copy in Arabic, owner · opt.lock=blur, owner · opt.lock=mask, owner · opt.lock=avatar",
   "node": null,
   "css_path": null,
   "role": null,
   "message": "Text “Select City” is 2.71:1 (#9d9d9d on #ffffff) — WCAG AA asks 4.5:1: the product's own palette, for the designer",
   "expected": null,
   "actual": null,
   "evidence": "box 339,101,70,18",
   "waived": false,
   "waiver": null,
   "section_hint": "open-questions"
  },
  {
   "check": "pf.contrast",
   "severity": "warning",
   "screen": "leads-marketplace",
   "case": "web · owner, seeker, first-visit, filtered, no-results, loading, empty, error, owner › Expand side menu, owner › Select City, owner › Select Price, owner › Newest FirstHighest PriceLowest Price, seeker › Select Property Types, owner · missing data, owner · long data, owner · arabic data, owner · zero data, seeker · missing data, seeker · long data, seeker · arabic data, seeker · zero data, owner · new copy long, owner · new copy in Arabic, seeker · new copy long, seeker · new copy in Arabic, first-visit · new copy long, first-visit · new copy in Arabic, filtered · new copy long, filtered · new copy in Arabic, no-results · new copy long, no-results · new copy in Arabic, loading · new copy long, loading · new copy in Arabic, empty · new copy long, empty · new copy in Arabic, error · new copy long, error · new copy in Arabic, owner · opt.lock=blur, owner · opt.lock=mask, owner · opt.lock=avatar",
   "node": null,
   "css_path": null,
   "role": null,
   "message": "Text “Select Price” is 2.71:1 (#9d9d9d on #ffffff) — WCAG AA asks 4.5:1: the product's own palette, for the designer",
   "expected": null,
   "actual": null,
   "evidence": "box 551,101,77,18",
   "waived": false,
   "waiver": null,
   "section_hint": "open-questions"
  },
  {
   "check": "pf.contrast",
   "severity": "warning",
   "screen": "leads-marketplace",
   "case": "web · owner, first-visit, filtered, no-results, bought, gone, loading, empty, error, owner › Expand side menu, owner › Select City, owner › Select Price, owner › Newest FirstHighest PriceLowest Price, owner · missing data, owner · long data, owner · arabic data, owner · zero data, owner · opt.lock=blur, owner · opt.lock=mask, owner · opt.lock=avatar",
   "node": null,
   "css_path": null,
   "role": null,
   "message": "Text “Owner Leads” is 3.38:1 (#249f62 on #ffffff) — WCAG AA asks 4.5:1: the product's own palette, for the designer",
   "expected": null,
   "actual": null,
   "evidence": "box 104,183,88,18",
   "waived": false,
   "waiver": null,
   "section_hint": "open-questions"
  },
  {
   "check": "pf.contrast",
   "severity": "warning",
   "screen": "leads-marketplace",
   "case": "web · owner, first-visit, filtered, no-results, bought, gone, loading, error, owner › Expand side menu, owner › Select City, owner › Select Price, owner › Newest FirstHighest PriceLowest Price, owner · missing data, owner · long data, owner · arabic data, owner · zero data, owner · new copy long, owner · new copy in Arabic, first-visit · new copy long, first-visit · new copy in Arabic, filtered · new copy long, filtered · new copy in Arabic, no-results · new copy long, no-results · new copy in Arabic, bought · new copy long, bought · new copy in Arabic, gone · new copy long, gone · new copy in Arabic, loading · new copy long, loading · new copy in Arabic, error · new copy long, error · new copy in Arabic, owner · opt.lock=blur, owner · opt.lock=mask, owner · opt.lock=avatar",
   "node": null,
   "css_path": null,
   "role": null,
   "message": "Text “10” is 3.06:1 (#249f62 on #e9f7f0) — WCAG AA asks 4.5:1: the product's own palette, for the designer",
   "expected": null,
   "actual": null,
   "evidence": "box 200,184,28,16",
   "waived": false,
   "waiver": null,
   "section_hint": "open-questions"
  },
  {
   "check": "pf.contrast",
   "severity": "warning",
   "screen": "leads-marketplace",
   "case": "web · owner, seeker, first-visit, filtered, no-results, bought, gone, loading, empty, error, owner › Expand side menu, owner › Select City, owner › Select Price, owner › Newest FirstHighest PriceLowest Price, seeker › Select Property Types, owner · missing data, owner · long data, owner · arabic data, owner · zero data, seeker · missing data, seeker · long data, seeker · arabic data, seeker · zero data, owner · opt.lock=blur, owner · opt.lock=mask, owner · opt.lock=avatar",
   "node": null,
   "css_path": null,
   "role": null,
   "message": "Text “Top up” is 3.38:1 (#249f62 on #ffffff) — WCAG AA asks 4.5:1: the product's own palette, for the designer",
   "expected": null,
   "actual": null,
   "evidence": "box 1218,183,44,18",
   "waived": false,
   "waiver": null,
   "section_hint": "open-questions"
  },
  {
   "check": "pf.contrast",
   "severity": "warning",
   "screen": "leads-marketplace",
   "case": "web · owner, seeker, first-visit, filtered, bought, gone, owner › Expand side menu, owner › Select City, owner › Select Price, owner › Newest FirstHighest PriceLowest Price, seeker › Select Property Types, owner · missing data, owner · long data, owner · arabic data, owner · zero data, seeker · missing data, seeker · long data, seeker · arabic data, seeker · zero data, owner · opt.lock=blur, owner · opt.lock=mask, owner · opt.lock=avatar",
   "node": null,
   "css_path": null,
   "role": null,
   "message": "Text “Not shared” is 2.71:1 (#9d9d9d on #ffffff) — WCAG AA asks 4.5:1: the product's own palette, for the designer",
   "expected": null,
   "actual": null,
   "evidence": "box 810,314,70,18",
   "waived": false,
   "waiver": null,
   "section_hint": "open-questions"
  },
  {
   "check": "pf.contrast",
   "severity": "warning",
   "screen": "leads-marketplace",
   "case": "web · owner, first-visit, filtered, buy, bought, insufficient, staff-cap, gone, owner › Expand side menu, owner › listings--modal-help-support-profolio, owner › Post a Listing, owner › listings--popover-notifications-mark-all-as, owner › listings--popover-faisal-al-harbi-agency-user, owner › Select City, owner › Select Price, owner › Newest FirstHighest PriceLowest Price, owner · missing data, owner · long data, owner · arabic data, owner · zero data, owner · new copy long, owner · new copy in Arabic, first-visit · new copy long, first-visit · new copy in Arabic, filtered · new copy long, filtered · new copy in Arabic, buy · new copy long, buy · new copy in Arabic, bought · new copy long, bought · new copy in Arabic, insufficient · new copy long, insufficient · new copy in Arabic, staff-cap · new copy long, staff-cap · new copy in Arabic, gone · new copy long, gone · new copy in Arabic, owner · opt.lock=blur, owner · opt.lock=mask, owner · opt.lock=avatar",
   "node": null,
   "css_path": null,
   "role": null,
   "message": "Text “Buy for 40 Credits” is 2.76:1 (#ffffff on #28b16d) — WCAG AA asks 4.5:1: the product's own palette, for the designer",
   "expected": null,
   "actual": null,
   "evidence": "box 1272,314,119,18",
   "waived": false,
   "waiver": null,
   "section_hint": "open-questions"
  },
  {
   "check": "pf.contrast",
   "severity": "warning",
   "screen": "leads-marketplace",
   "case": "web · owner, first-visit, filtered, buy, bought, insufficient, staff-cap, gone, owner › Expand side menu, owner › listings--modal-help-support-profolio, owner › Post a Listing, owner › listings--popover-notifications-mark-all-as, owner › listings--popover-faisal-al-harbi-agency-user, owner › Select City, owner › Select Price, owner › Newest FirstHighest PriceLowest Price, owner · missing data, owner · long data, owner · arabic data, owner · zero data, owner · new copy long, owner · new copy in Arabic, first-visit · new copy long, first-visit · new copy in Arabic, filtered · new copy long, filtered · new copy in Arabic, buy · new copy long, buy · new copy in Arabic, bought · new copy long, bought · new copy in Arabic, insufficient · new copy long, insufficient · new copy in Arabic, staff-cap · new copy long, staff-cap · new copy in Arabic, gone · new copy long, gone · new copy in Arabic, owner · opt.lock=blur, owner · opt.lock=mask, owner · opt.lock=avatar",
   "node": null,
   "css_path": null,
   "role": null,
   "message": "Text “40” is 2.76:1 (#ffffff on #28b16d) — WCAG AA asks 4.5:1: the product's own palette, for the designer",
   "expected": null,
   "actual": null,
   "evidence": "box 1322,314,18,18",
   "waived": false,
   "waiver": null,
   "section_hint": "open-questions"
  },
  {
   "check": "pf.contrast",
   "severity": "warning",
   "screen": "leads-marketplace",